{
  "protocol_version": 2,
  "instance_id": "11111111-1111-4111-8111-111111111111",
  "app_id": "document-summarizer",
  "pid": 4242,
  "started_at": "2026-08-30T12:00:00Z",
  "transport": {
    "kind": "http-loopback-v2",
    "base_url": "http://127.0.0.1:43127/"
  },
  "auth": {
    "scheme": "bearer",
    "token": "AAAAAAAAAAAAAAAAAAAAAAAAAAAAAAAAAAAAAAAAAAA"
  }
}
